{
  "schemaVersion": 1,
  "assemblyId": "conversation",
  "contractId": "jarvis.action-intent",
  "status": "draft",
  "invariantDigest": "53a67a36a2d8b55e086306143def118c4361d93108844997b698f16c0283caf5",
  "modules": [
    {
      "id": "core-system",
      "version": "5.0.0",
      "sha256": "2b455131c2e686954861cc4e09105dd1c54adb0347524ee7f9dcf1dcad467e34"
    },
    {
      "id": "constitution",
      "version": "5.0.0",
      "sha256": "b7c7e3528f4c6cb6b964a07ba85b43b1e23c1ad28e5b114d4bd6bcddf7e87b11"
    },
    {
      "id": "source-grounding",
      "version": "5.0.0",
      "sha256": "3d1ac9010462d417a337c171802f02ccedead4fe1afef981a9dfddc11314c22a"
    },
    {
      "id": "uncertainty",
      "version": "5.0.0",
      "sha256": "f4cf65b81bdd0ba2e8c74a5b3018c52417da55e76f42e1d92e79d60995f24906"
    },
    {
      "id": "security-privacy",
      "version": "5.0.0",
      "sha256": "d9b704d898e125034438d04874e1b6b1d6f69612b6b7c34aae71ee2aea306427"
    },
    {
      "id": "tool-policy",
      "version": "5.0.0",
      "sha256": "9210bac654e30062c1384f1f483c71e115fdb6563d52a24f47764b7dd6ce5661"
    },
    {
      "id": "message-writer",
      "version": "5.0.0",
      "sha256": "d14f1fbbad03575853b2821210b54dac0364bb083f51de3450902d0364068cc2"
    },
    {
      "id": "memory-extractor",
      "version": "5.0.0",
      "sha256": "901442d4d20f946fccfd0e1fc711741a512af2646402089257f35e1f9ea587b5"
    },
    {
      "id": "accountability",
      "version": "5.0.0",
      "sha256": "d9316c4496ce49ac08dc15bebd347ffcb5093085420f3c485ea5fd46d4930e13"
    },
    {
      "id": "planner",
      "version": "5.0.0",
      "sha256": "6c77e86db54351901aa0b100e88e75dcf000b597102db10f42b7fd14a02a8ced"
    }
  ],
  "contentSha256": "9c00de2dd0888dedb29c92efcd753a0143e60e31577a16c1422acace5073cf08",
  "utf8Bytes": 5290,
  "producerCommit": null
}
